<?xml version="1.0" encoding="UTF-8"?>
<xs:schema xmlns:xs="http://www.w3.org/2001/XMLSchema" elementFormDefault="qualified">
  <xs:element name="Companion_Animal">
    <xs:complexType>
      <xs:sequence>
        <xs:element ref="animal" maxOccurs="unbounded"/>
      </xs:sequence>
    </xs:complexType>
  </xs:element>
  <xs:element name="animal">
    <xs:complexType>
      <xs:sequence>
        <xs:element ref="Food"/>
        <xs:element ref="Snack"/>
        <xs:element ref="Else"/>
      </xs:sequence>
      <xs:attribute name="animal_species" type="xs:string" use="required"/>
    </xs:complexType>
  </xs:element>
  <xs:element name="Food">
    <xs:complexType>
      <xs:sequence>
        <xs:element ref="name" maxOccurs="unbounded"/>
      </xs:sequence>
    </xs:complexType>
  </xs:element>
  <xs:element name="name">
    <xs:complexType>
      <xs:sequence>
        <xs:element ref="image"/>
        <xs:element name="description" type="xs:string"/>
        <xs:element name="price" type="xs:string"/>
      </xs:sequence>
    </xs:complexType>
  </xs:element>
  <xs:element name="image">
    <xs:complexType mixed="true">
      <xs:attribute name="src" type="xs:string" use="required"/>
    </xs:complexType>
  </xs:element>
  <xs:element name="Snack">
    <xs:complexType>
      <xs:sequence>
        <xs:element ref="name" maxOccurs="unbounded"/>
      </xs:sequence>
    </xs:complexType>
  </xs:element>
  <xs:element name="Else">
    <xs:complexType>
      <xs:sequence>
        <xs:element ref="name" maxOccurs="unbounded"/>
      </xs:sequence>
    </xs:complexType>
  </xs:element>
</xs:schema>
